{
  "id": "example",
  "object": "email_address",
  "email_address": "jane@example.com",
  "reserved": false,
  "verification": {
    "object": "verification_otp",
    "status": "unverified",
    "strategy": "phone_code",
    "attempts": 0,
    "expire_at": 1747939800,
    "verified_at_client": "example"
  },
  "linked_to": [
    {
      "type": "example",
      "id": "example"
    }
  ],
  "matches_sso_connection": false,
  "created_at": 0,
  "updated_at": 0
}